### ISSUE TITLE
用户意图分析bug，当用户说再见后，服务端意图分析结果为空（意图识别模式为：intent_llm，LLM为：DifyLLM，Dify后端接的Qwen-Max-latest）

### ISSUE THREAD

**Issue by manicwy** [xinnan-tech/xiaozhi-esp32-server#287]
![Image](https://github.com/user-attachments/assets/e597b329-d82a-4cfe-9dc8-28f39aada29b)

**Comment by Jimmy-L99** [comment]
请教一下dify接的是聊天助手还是工作流呀，我这边聊天助手和工作流都尝试过了，服务端消息都传不到dify（dify本地部署）。

**Comment by wangjie201701** [comment]
> 请教一下dify接的是聊天助手还是工作流呀，我这边聊天助手和工作流都尝试过了，服务端消息都传不到dify（dify本地部署）。 `http://localhost/v1/workflows/run`和`http://localhost/v1/chat-messages`

  将示例中的 http://xxx.xxx.xxx.xxx/v1/chat-messages 改为 http://xxx.xxx.xxx.xxx:8088/v1/chat-messages（注意添加 :8088 端口）。我的改完后，可以正常请求到了。

我的网页版访问是地址 http://xxx.xxx.xxx.xxx:8088/app/4119c6d0-75e3-42fa-9e7c-85bdfc27c590/develop

**Comment by Jimmy-L99** [comment]
> > 请教一下dify接的是聊天助手还是工作流呀，我布拉格聊天助手和工作流都尝试过了，服务端消息都传不到dify（dify本地部署）。`http://localhost/v1/workflows/run`和`http://localhost/v1/chat-messages`
> 
> 将示例中的http://xxx.xxx.xxx.xxx/v1/chat-messages改为[http://xxx.xxx.xxx.xxx:8088/v1/chat-messages（注意添加](http://xxx.xxx.xxx.xxx:8088/v1/chat-messages%EF%BC%88%E6%B3%A8%E6%84%8F%E6%B7%BB%E5%8A%A0):8088端口）。我的改完后，可以正常请求到了。
> 
> 我的网页版访问地址是http://xxx.xxx.xxx.xxx:8088/app/4119c6d0-75e3-42fa-9e7c-85bdfc27c590/develop

我搞明白了，通过抓包发现，我这边url填到`http://xxx/v1`，因为貌似server里面已经写死`/chat-messages`，如果填完整的就变成` /v1/chat-messages/chat-messages`了。所以结论是只能用dify里面的聊天助手....

```
(base) root@node1:~# sudo tcpdump -i eno1 dst port 8081 -A
tcpdump: verbose output suppressed, use -v or -vv for full protocol decode
listening on eno1, link-type EN10MB (Ethernet), capture size 262144 bytes
11:32:09.291480 IP 10.10.10.231.37160 > node1.tproxy: Flags [S], seq 1166723463, win 29200, options [mss 1460,nop,nop,sackOK,nop,wscale 7], length 0
E..4.!..?...


......(..E.........r.f...............
11:32:09.291751 IP 10.10.10.231.37160 > node1.tproxy: Flags [.], ack 2065147235, win 229, length 0
E..(."..?...


......(..E...{..cP.............
11:32:09.296942 IP 10.10.10.231.37160 > node1.tproxy: Flags [P.], seq 0:426, ack 1, win 229, length 426
E....#..?..g


......(..E...{..cP...1?..POST /v1/chat-messages/chat-messages HTTP/1.1
Host: 172.16.21.155:8081
User-Agent: python-requests/2.32.3
Accept-Encoding: gzip, deflate
Accept: */*
Connection: keep-alive
Authorization: Bearer app-x2AfqJRUwPOpdu4fk28usvY8
Content-Length: 141
Content-Type: application/json

{"query": "\u8bf4\u8bf4\u8bdd\u8bf4\u8bdd\u3002", "response_mode": "streaming", "user": "b1b98f6f-00f4-4613-87d3-8417da5438b6", "inputs": {}}
11:32:09.299793 IP 10.10.10.231.37160 > node1.tproxy: Flags [.], ack 209, win 237, length 0
E..(.$..?...
```
@xinnan-tech 请教一下大佬目前是不支持dify工作流吗？

**Comment by yanyige** [comment]
我就是用的dify，肯定是支持的。url 这样写 https://api.dify.ai/v1

<img width="687" alt="Image" src="https://github.com/user-attachments/assets/46294499-51f1-4889-be36-79e597de8dbb" />

**Comment by Jimmy-L99** [comment]
> 我就是用的dify，肯定是支持的。url这样写https://api.dify.ai/v1
> 
> <img alt="图像" width="687" src="https://private-user-images.githubusercontent.com/12892756/421731400-46294499-51f1-4889-be36-79e597de8dbb.png?jwt=eyJhbGciOiJIUzI1NiIsInR5cCI6IkpXVCJ9.eyJpc3MiOiJnaXRodWIuY29tIiwiYXVkIjoicmF3LmdpdGh1YnVzZXJjb250ZW50LmNvbSIsImtleSI6ImtleTUiLCJleHAiOjE3NDE3NjA1NjEsIm5iZiI6MTc0MTc2MDI2MSwicGF0aCI6Ii8xMjg5Mjc1Ni80MjE3MzE0MDAtNDYyOTQ0OTktNTFmMS00ODg5LWJlMzYtNzllNTk3ZGU4ZGJiLnBuZz9YLUFtei1BbGdvcml0aG09QVdTNC1ITUFDLVNIQTI1NiZYLUFtei1DcmVkZW50aWFsPUFLSUFWQ09EWUxTQTUzUFFLNFpBJTJGMjAyNTAzMTIlMkZ1cy1lYXN0LTElMkZzMyUyRmF3czRfcmVxdWVzdCZYLUFtei1EYXRlPTIwMjUwMzEyVDA2MTc0MVomWC1BbXotRXhwaXJlcz0zMDAmWC1BbXotU2lnbmF0dXJlPTMwMDY2MzQzOGQyNzRkMGJlYzMyN2ZkNWEwM2RjMzg2ZGZiZDViNzQzNWQwZTRjMmQzNmJiODllNGRjOWQxODMmWC1BbXotU2lnbmVkSGVhZGVycz1ob3N0In0.haQ6oe00SzLS1yc1QV6IA4TL9RGNtqveHjyl_-V3umY">

是的我发现了，我以为要写到/v1/chat-message。

**Comment by xinnan-tech** [comment]
明白，我们会修复这个问题

**Comment by xinnan-tech** [comment]
Homeassistant 、Dify、Coze属于平台式LLM，我们将使用独立LLM解决它的意图。与这个问题类似[https://github.com/xinnan-tech/xiaozhi-esp32-server/issues/317 ]，经请留意。
